<!ELEMENT college (students+,courses)>
<!ELEMENT students (fullName,regNo,DateofBirth)>
<!ELEMENT fullName (firstName,lastName)>
<!ELEMENT firstName (#PCDATA)>
<!ELEMENT lastName (#PCDATA)>
<!ELEMENT regNo (#PCDATA)>
<!ELEMENT DateofBirth (#PCDATA)>
<!ELEMENT courses (course+)>
<!ELEMENT course (courseName,creditHours)>
<!ELEMENT courseName (#PCDATA)>
<!ELEMENT CreditHours (#PCDATA)>
